{"receipt_version":"1.0","receipt_id":"aaaaaaaaaaaaaaaaaaaaaaaaaaaaaaaaaaaaaaaaaaaaaaaaaaaaaaaaaaaaaaaa","decision_id":"bbbbbbbbbbbbbbbbbbbbbbbbbbbbbbbbbbbbbbbbbbbbbbbbbbbbbbbbbbbbbbbb","run_id":"run-1","operation_id":"read-file","effective_scope":{"kind":"filesystem","path":"docs/readme.md"},"profile_sha256":"cccccccccccccccccccccccccccccccccccccccccccccccccccccccccccccccc","policy_sha256":"dddddddddddddddddddddddddddddddddddddddddddddddddddddddddddddddd","workspace_id":"workspace-1","snapshot_digest":"eeeeeeeeeeeeeeeeeeeeeeeeeeeeeeeeeeeeeeeeeeeeeeeeeeeeeeeeeeeeeeee","outcome":"delivered","reason_code":"read_delivered","bytes_read":4,"content_sha256":"75c75efe327a036499b0b0bf8d2e57a4cd8e15e6d029c21a76a69e4fa6e93a12","timestamp":"2026-09-22T00:00:00Z","provenance":{"runtime_version":"1.0","kind":"redacted_runtime_receipt"}}
